{
  "$schema": "../schemas/engagement-benchmark.schema.json",
  "required_genres": ["mystery", "romance", "fantasy"],
  "required_routes": ["interest", "suspense", "genre-delight", "next-click"],
  "required_issue_codes": [
    "manuscript-signature-scene-image-not-evidenced",
    "manuscript-character-appeal-signature-not-evidenced",
    "manuscript-payoff-delight-not-evidenced",
    "manuscript-genre-delight-not-evidenced",
    "manuscript-ending-hook-setup-not-evidenced",
    "manuscript-ending-hook-question-too-broad",
    "manuscript-narrative-transportation-not-evidenced",
    "manuscript-protagonist-agency-not-evidenced",
    "manuscript-choice-tradeoff-not-evidenced",
    "manuscript-choice-cost-lock-not-evidenced",
    "manuscript-tactical-adaptation-not-evidenced",
    "manuscript-dialogue-subtext-not-evidenced",
    "manuscript-dialogue-turn-not-evidenced",
    "manuscript-dialogue-state-carryover-not-evidenced",
    "manuscript-character-voice-not-differentiated",
    "manuscript-causal-chain-not-evidenced",
    "manuscript-convenient-resolution-not-evidenced",
    "manuscript-stakes-subject-not-personalized"
  ],
  "required_positive_quality_codes": [
    "signature-scene-image",
    "character-appeal-signature",
    "protagonist-agency",
    "choice-cost-tradeoff",
    "choice-cost-lock",
    "tactical-adaptation",
    "payoff-delight",
    "genre-delight",
    "next-click-compulsion",
    "narrative-transportation",
    "dialogue-subtext-turn",
    "causal-chain"
  ],
  "minimum_samples_per_required_issue_code": 1,
  "minimum_samples_per_required_positive_quality_code": 1,
  "required_series_length": 3,
  "required_positive_series_length": 3,
  "minimum_holdout_samples": 1,
  "minimum_usable_holdout_samples": 1,
  "minimum_failing_holdout_samples": 1,
  "minimum_usable_failing_holdout_samples": 1,
  "samples": [
    {
      "id": "chapter-001-good-mystery",
      "label": "1화 미스터리 고점 샘플",
      "genre": "mystery",
      "routes": ["interest", "suspense", "genre-delight", "next-click"],
      "positive_quality_codes": [
        "signature-scene-image",
        "character-appeal-signature",
        "protagonist-agency",
        "choice-cost-tradeoff",
        "choice-cost-lock",
        "tactical-adaptation",
        "payoff-delight",
        "genre-delight",
        "next-click-compulsion",
        "narrative-transportation",
        "dialogue-subtext-turn",
        "causal-chain"
      ],
      "chapter": 1,
      "version": 1,
      "calibration_split": "calibration",
      "expected_passed": true,
      "forbidden_issue_codes": [
        "manuscript-payoff-delight-not-evidenced",
        "manuscript-ending-hook-closed"
      ],
      "expected_min_score": 90
    },
    {
      "id": "chapter-001-flat-payoff",
      "label": "보상 고점이 약한 실패 샘플",
      "genre": "mystery",
      "routes": ["interest", "suspense"],
      "chapter": 1,
      "version": 1,
      "calibration_split": "holdout",
      "manuscript_path": "reviews/engagement-benchmark/fixtures/chapter-001-flat-payoff.md",
      "expected_passed": false,
      "expected_issue_codes": ["manuscript-payoff-delight-not-evidenced"],
      "expected_max_score": 84
    },
    {
      "id": "chapter-001-convenient-resolution",
      "label": "우연한 해결에 의존한 실패 샘플",
      "genre": "mystery",
      "routes": ["interest", "suspense"],
      "chapter": 1,
      "version": 1,
      "calibration_split": "holdout",
      "manuscript_path": "reviews/engagement-benchmark/fixtures/chapter-001-convenient-resolution.md",
      "expected_passed": false,
      "expected_issue_codes": ["manuscript-convenient-resolution-not-evidenced"],
      "expected_max_score": 84
    },
    {
      "id": "chapter-001-non-personalized-stakes",
      "label": "피해자/표적이 개인화되지 않은 실패 샘플",
      "genre": "mystery",
      "routes": ["interest", "suspense"],
      "chapter": 1,
      "version": 1,
      "calibration_split": "holdout",
      "manuscript_path": "reviews/engagement-benchmark/fixtures/chapter-001-non-personalized-stakes.md",
      "expected_passed": false,
      "expected_issue_codes": ["manuscript-stakes-subject-not-personalized"],
      "expected_max_score": 84
    }
  ]
}
